<?xml version="1.0" standalone="no"?>
<!DOCTYPE movies SYSTEM "Movie.dtd">
<movies>
  <movie type="vxv" rating="PG-13" review="5" year="1987">
    <title>Raising Arizona</title>
    <writer>Ethan Coen</writer>
    <producer>Ethan Coen</producer>
    <director>Joel Coen</director>
    <actor>Nicolas Cage</actor>
    <actor>Holly Hunter</actor>
    <comments>Classic</comments>
  </movie>
</movies>
